{
  "spec_version": 1,
  "pool": {
    "ticker": "OURO",
    "network": "preprod",
    "network_magic": 1,
    "genesis_hashes": {
      "shelley": "162d29c4e1cf6b8a84f2d692e67a3ac6bc7851bc3e6e4afe64d15778bed8bd86"
    },
    "metadata_url": "https://pool.example.com/metadata.json",
    "pledge_lovelace": 100000000000,
    "margin": 0.02,
    "cost_lovelace": 340000000
  },
  "topology_mode": "p2p",
  "node_version": "10.5.4",
  "machines": [
    {
      "id": "bp1",
      "role": "bp",
      "ssh": {
        "host": "10.0.0.10",
        "port": 22,
        "user": "ouro-exec",
        "key_ref": "creds://bp1"
      }
    },
    {
      "id": "relay1",
      "role": "relay",
      "public_endpoint": {
        "host": "relay1.example.com",
        "port": 3001
      },
      "ssh": {
        "host": "203.0.113.5",
        "port": 22,
        "user": "ouro-exec",
        "key_ref": "creds://relay1"
      }
    }
  ],
  "sync": {
    "mode": "genesis"
  }
}
